{
  "$schema": "https://json-schema.org/draft/2020-12/schema",
  "$id": "phase-loop-doctor.v1",
  "$comment": "Checked-in contract for `phase-loop doctor --json` (IF-0-AHADOPT-2). Metadata-only: NO absolute paths. Separate from phase-loop-install-status.v1 and the dotfiles adoption-bundle. Hand-authored; a golden fixture (phase-loop-doctor.v1.golden.json) and live output both validate against it.",
  "type": "object",
  "additionalProperties": false,
  "required": ["schema", "summary", "tools", "stack_hints", "declared_contracts", "install_surfaces", "bom", "worktree_divergence"],
  "properties": {
    "schema": {
      "const": "phase-loop-doctor.v1"
    },
    "summary": {
      "type": "string"
    },
    "stack_hints": {
      "type": "array",
      "description": "Stack marker files present (from repo_validation.doctor_report; superset). Filenames only — metadata-only.",
      "items": { "type": "string" }
    },
    "declared_contracts": {
      "type": "array",
      "description": "Declared agent validation contracts (from repo_validation.doctor_report; superset).",
      "items": {
        "type": "object",
        "additionalProperties": false,
        "required": ["target", "runner"],
        "properties": {
          "target": { "type": "string" },
          "runner": { "type": "string" }
        }
      }
    },
    "tools": {
      "type": "array",
      "items": {
        "type": "object",
        "additionalProperties": false,
        "required": ["name", "present", "authed", "unlocks"],
        "properties": {
          "name": { "type": "string" },
          "present": { "type": "boolean" },
          "authed": { "type": ["boolean", "null"] },
          "unlocks": { "type": "string" }
        }
      }
    },
    "install_surfaces": {
      "type": "array",
      "items": {
        "type": "object",
        "additionalProperties": false,
        "required": ["surface", "status"],
        "properties": {
          "surface": {
            "type": "string",
            "enum": ["wheel-bundled-skills", "interactive-harness-skills"]
          },
          "harness": { "type": ["string", "null"] },
          "status": {
            "type": "string",
            "enum": ["present", "partial", "missing", "unknown"]
          },
          "unlocks": { "type": "string" }
        }
      }
    },
    "bom": {
      "type": "array",
      "description": "BOM inventory v1: named pin-vs-registry-latest targets across PyPI + npm.",
      "items": {
        "type": "object",
        "additionalProperties": false,
        "required": ["target", "ecosystem", "pinned", "latest", "verdict", "gating"],
        "properties": {
          "target": { "type": "string" },
          "ecosystem": {
            "type": "string",
            "enum": ["pypi", "pypi(phase-loop-runtime)", "npm", "dotfiles", "git-clone"]
          },
          "pinned": { "type": ["string", "null"] },
          "latest": { "type": ["string", "null"] },
          "verdict": {
            "type": "string",
            "enum": ["stale", "current", "unknown"]
          },
          "gating": {
            "type": "boolean",
            "description": "When true, a `stale` verdict makes `phase-loop doctor --fail-on-stale` exit non-zero. Repo-owned targets gate; vendored/foreign refs are reported but do not gate."
          },
          "note": { "type": "string" }
        }
      }
    },
    "worktree_divergence": {
      "type": "object",
      "description": "PUSHFLOW: ahead-of-base divergence aggregate mirroring the worktree index's per-worktree commits_ahead_of_origin. Counts only — metadata-only, NO worktree paths. Advisory (verdict warn|ok); never human_required.",
      "additionalProperties": false,
      "required": ["base_ref", "worktree_count", "max_commits_ahead", "threshold", "verdict"],
      "properties": {
        "base_ref": { "type": "string" },
        "worktree_count": { "type": "integer" },
        "max_commits_ahead": { "type": "integer" },
        "threshold": { "type": "integer" },
        "verdict": {
          "type": "string",
          "enum": ["ok", "warn"]
        }
      }
    },
    "seat_jail_prerequisites": {
      "type": "array",
      "description": "agent-harness#1357: prerequisites of the seat jail's qualification that live in the runtime's environment (pytest). Status only; `fix` is the literal command and appears only when the prerequisite is missing. Metadata-only: NO absolute paths. Additive: not in `required`, so v0.7.25 payloads still validate.",
      "items": {
        "type": "object",
        "additionalProperties": false,
        "required": ["name", "status", "unlocks"],
        "properties": {
          "name": { "type": "string" },
          "status": { "type": "string", "enum": ["present", "missing", "unknown"] },
          "unlocks": { "type": "string" },
          "fix": { "type": "string" }
        }
      }
    },
    "seat_cli_qualification": {
      "type": "array",
      "description": "agent-harness#1431 / agent-harness#1420: whether a review seat's CLI is admitted on this host under THIS runtime. Today one row: the agy on PATH (the Gemini seat). `release_qualified` and `locally_qualified` are admitted; `local_record_other_runtime` means the host qualified this build under another runtime (a runtime upgrade drops the record); `not_qualified` means the build is not shipped and has no local record. `fix` is the command to run and appears only when the CLI is not admitted. Read-only (nothing is executed or qualified). Metadata-only: NO absolute paths. Additive: not in `required`, so earlier payloads still validate.",
      "items": {
        "type": "object",
        "additionalProperties": false,
        "required": ["harness", "cli", "status", "detail", "shipped_build_later_on_path"],
        "properties": {
          "harness": { "type": "string" },
          "cli": { "type": "string" },
          "status": {
            "type": "string",
            "enum": ["absent", "unknown", "release_qualified", "self_qualification_disabled", "store_unsafe", "local_qualification_failed", "locally_qualified", "local_record_other_runtime", "not_qualified"]
          },
          "detail": { "type": "string" },
          "release": { "type": "string" },
          "shipped_build_later_on_path": { "type": "boolean" },
          "fix": { "type": "string" },
          "note": { "type": "string" }
        }
      }
    }
  }
}
